sample_id,text_claim_detected,text_specificity,text_risk_score,text_raw_json,mm_claim_detected,mm_specificity,mm_risk_score,mm_raw_json,claim_changed,specificity_changed,risk_delta,image_added_value_flag
P015,True,specific,2,"{""claim_detected"": true, ""claim_modalities"": [""text"", ""image""], ""claim_types"": [""certification_or_label""], ""specificity"": ""specific"", ""evidence_strength"": ""moderate"", ""risk_score"": 2, ""risk_label"": ""low"", ""evidence"": [{""modality"": ""text"", ""snippet"": ""Labels: Vegetariano,fr:Ponto Verde"", ""explanation"": ""The product displays the 'Vegetariano' and 'Ponto Verde' labels, which are specific certifications or labels related to vegetarian suitability and packaging recycling respectively.""}], ""reasoning_summary"": ""The product includes specific labels indicating vegetarian suitability and participation in a packaging recycling program (Ponto Verde). These are concrete claims related to sustainability and environmental impact. However, there are no broader or sweeping environmental claims, and the packaging is plastic with a code indicating other plastics, which is neutral. Therefore, the greenwashing risk is low due to the presence of specific, verifiable labels and no vague or unsupported claims."", ""needs_human_check"": []}",True,specific,2,"{""claim_detected"": true, ""claim_modalities"": [""text"", ""image""], ""claim_types"": [""certification_or_label""], ""specificity"": ""specific"", ""evidence_strength"": ""moderate"", ""risk_score"": 2, ""risk_label"": ""low"", ""evidence"": [{""modality"": ""text"", ""snippet"": ""Labels: Vegetariano,fr:Ponto Verde"", ""explanation"": ""The product text explicitly lists the 'Vegetariano' and 'Ponto Verde' labels, which are recognized certifications or labels related to sustainability or environmental considerations.""}, {""modality"": ""image"", ""snippet"": ""Packaging shows the product name and image but no additional sustainability claims or certifications visible."", ""explanation"": ""The packaging image does not show explicit sustainability claims beyond the brand and product name, so it provides no additional support or risk.""}], ""reasoning_summary"": ""The product text includes specific sustainability-related labels, which are recognized certifications, providing moderate evidence of sustainability claims. The packaging image does not add further claims or cues. The claims are specific and supported by known labels, so the greenwashing risk is low (score 2)."", ""needs_human_check"": [""Verification of the authenticity and scope of the 'Vegetariano' and 'Ponto Verde' labels to confirm their sustainability relevance.""]}",False,False,0,False
P016,True,mixed,2,"{""claim_detected"": true, ""claim_modalities"": [""text""], ""claim_types"": [""certification_or_label""], ""specificity"": ""mixed"", ""evidence_strength"": ""moderate"", ""risk_score"": 2, ""risk_label"": ""low"", ""evidence"": [{""modality"": ""text"", ""snippet"": ""Labels: Point Vert, Fabriqué en France, Sans sucre ajouté, Nutriscore, Nutriscore B, Triman"", ""explanation"": ""The product displays several labels including 'Point Vert' which is an environmental label, indicating some sustainability positioning. Other labels relate to nutrition and recycling.""}], ""reasoning_summary"": ""The product carries the 'Point Vert' environmental label, which is a recognized certification related to sustainability, providing a specific and verifiable claim. Other labels relate to nutrition and recycling but do not directly indicate environmental claims. The presence of a recognized eco-label reduces greenwashing risk. However, no further detailed environmental claims or quantified sustainability benefits are stated, so the claim is limited in scope. Therefore, the risk is low but present due to limited claim breadth."", ""needs_human_check"": []}",True,specific,2,"{""claim_detected"": true, ""claim_modalities"": [""text"", ""image""], ""claim_types"": [""certification_or_label""], ""specificity"": ""specific"", ""evidence_strength"": ""moderate"", ""risk_score"": 2, ""risk_label"": ""low"", ""evidence"": [{""modality"": ""text"", ""snippet"": ""Labels: Point Vert,Fabriqué en France,Sans sucre ajouté,Nutriscore,Nutriscore B,Triman"", ""explanation"": ""The product lists several labels including 'Point Vert' which is an environmental label, and 'Fabriqué en France' indicating local production, which can be considered sustainability-related claims.""}, {""modality"": ""image"", ""snippet"": ""SAVOIR-FAIRE FRANÇAIS logo"", ""explanation"": ""The packaging shows a 'Savoir-Faire Français' logo, indicating French craftsmanship or production, which supports the 'Fabriqué en France' claim.""}], ""reasoning_summary"": ""The product makes explicit sustainability-related claims through the 'Point Vert' environmental label and the 'Fabriqué en France' claim supported by the logo on the packaging. These claims are specific and verifiable, though no detailed environmental benefits or certifications beyond 'Point Vert' are provided. There are no vague or broad claims, and the nature imagery is minimal and not over-interpreted. Therefore, the greenwashing risk is low (score 2)."", ""needs_human_check"": [""Verification of the authenticity and criteria of the 'Point Vert' label to confirm its environmental credibility.""]}",False,True,0,True
P017,True,mixed,2,"{""claim_detected"": true, ""claim_modalities"": [""text""], ""claim_types"": [""organic_or_natural"", ""other""], ""specificity"": ""mixed"", ""evidence_strength"": ""weak"", ""risk_score"": 2, ""risk_label"": ""low"", ""evidence"": [{""modality"": ""text"", ""snippet"": ""No preservatives, No colorings, No palm oil"", ""explanation"": ""These claims indicate absence of certain additives and ingredients, suggesting a natural or 'clean' product positioning, but do not directly address environmental sustainability.""}, {""modality"": ""text"", ""snippet"": ""Source of fibre, High fibres"", ""explanation"": ""Nutritional claims related to fiber content, not environmental claims.""}, {""modality"": ""text"", ""snippet"": ""Made in France"", ""explanation"": ""Indicates origin but does not imply sustainability.""}], ""reasoning_summary"": ""The product makes some claims related to naturalness and absence of certain additives (no preservatives, no colorings, no palm oil), which can be interpreted as mild sustainability-related cues. However, these claims are limited in scope, not specific to environmental impact, and lack measurable or verifiable environmental benefits. There are no explicit claims about recyclability, biodegradability, carbon footprint, or certifications. Therefore, the greenwashing risk is low but present due to mild nature-positioning without strong substantiation."", ""needs_human_check"": []}",True,mixed,2,"{""claim_detected"": true, ""claim_modalities"": [""text"", ""image""], ""claim_types"": [""organic_or_natural"", ""other""], ""specificity"": ""mixed"", ""evidence_strength"": ""moderate"", ""risk_score"": 2, ""risk_label"": ""low"", ""evidence"": [{""modality"": ""text"", ""snippet"": ""No preservatives, No colorings, No palm oil, Source of fibre, High fibres, Nutriscore Grade A"", ""explanation"": ""These are explicit claims about the product's composition and nutritional quality, indicating some health and environmental considerations.""}, {""modality"": ""image"", ""snippet"": ""Riche en fibres au son de blé, -43% de sucres, Sans huile de palme, Nutri-Score A"", ""explanation"": ""The packaging highlights high fiber content, reduced sugar, no palm oil, and a good Nutri-Score, supporting health and sustainability claims.""}], ""reasoning_summary"": ""The product makes several explicit claims related to health and environmental aspects, such as no palm oil, no preservatives, and high fiber content. These claims are somewhat specific and supported by nutritional labeling (Nutri-Score). However, there is no direct claim about organic certification or detailed environmental impact, and the packaging is plastic and cardboard, which is typical but not highlighted as sustainable. The claims are moderate in specificity and supported by visible evidence, leading to a low greenwashing risk score of 2."", ""needs_human_check"": []}",False,False,0,False
P018,True,specific,2,"{""claim_detected"": true, ""claim_modalities"": [""text""], ""claim_types"": [""organic_or_natural"", ""certification_or_label"", ""vague_eco_language""], ""specificity"": ""specific"", ""evidence_strength"": ""strong"", ""risk_score"": 2, ""risk_label"": ""low"", ""evidence"": [{""modality"": ""text"", ""snippet"": ""Organic, Certified by Ecocert, EU Organic, AB Agriculture Biologique, FR-BIO-01, ES-ECO-019-CT, EU Agriculture, EU/non-EU Agriculture"", ""explanation"": ""Multiple organic certifications and labels indicate a specific and verifiable claim about organic agriculture.""}, {""modality"": ""text"", ""snippet"": ""No preservatives, No additives, No colorings, Natural colorings"", ""explanation"": ""Claims about absence of preservatives, additives, and use of natural colorings are specific but not quantified or further substantiated here.""}, {""modality"": ""text"", ""snippet"": ""Vegetarian, Vegan, Source of fibre, High fibres"", ""explanation"": ""These are product attribute claims that relate to dietary and nutritional aspects, supporting a natural and health-oriented positioning.""}], ""reasoning_summary"": ""The product makes multiple specific and verifiable claims related to organic certification and natural ingredients, supported by recognized labels. Additional claims about no preservatives and natural colorings are specific but lack detailed substantiation in the text. The overall positioning is health- and nature-oriented but not exaggerated or vague. Therefore, the greenwashing risk is low (score 2)."", ""needs_human_check"": []}",True,specific,1,"{""claim_detected"": true, ""claim_modalities"": [""text"", ""image""], ""claim_types"": [""organic_or_natural"", ""certification_or_label"", ""plant_based""], ""specificity"": ""specific"", ""evidence_strength"": ""strong"", ""risk_score"": 1, ""risk_label"": ""low"", ""evidence"": [{""modality"": ""text"", ""snippet"": ""issue de l'agriculture biologique, Organic, Certified by Ecocert, EU Organic, AB Agriculture Biologique"", ""explanation"": ""Multiple organic certifications and labels explicitly indicate organic farming practices.""}, {""modality"": ""text"", ""snippet"": ""Spécialité végétale à base de blé et d'épeautre"", ""explanation"": ""The product is explicitly described as a plant-based specialty, indicating a sustainability-related positioning.""}, {""modality"": ""image"", ""snippet"": ""AB logo (Agriculture Biologique) and 'Céréal BIO' brand name"", ""explanation"": ""The packaging shows the official organic certification logo and brand name emphasizing organic nature.""}], ""reasoning_summary"": ""The product makes clear, specific claims about being organic and plant-based, supported by recognized certifications visible on the packaging. The claims are specific and verifiable, reducing greenwashing risk. The packaging uses natural imagery but does not rely solely on vague nature cues. The risk score is low (1) due to the strong organic certification and clear plant-based claim, with no broad or unsupported claims present."", ""needs_human_check"": []}",False,False,-1,True
P019,True,specific,2,"{""claim_detected"": true, ""claim_modalities"": [""text""], ""claim_types"": [""packaging_reduction"", ""certification_or_label""], ""specificity"": ""specific"", ""evidence_strength"": ""moderate"", ""risk_score"": 2, ""risk_label"": ""low"", ""evidence"": [{""modality"": ""text"", ""snippet"": ""Emballage recyclable à 100%"", ""explanation"": ""The packaging is claimed to be 100% recyclable, which is a specific and measurable claim about recyclability.""}, {""modality"": ""text"", ""snippet"": ""Triman"", ""explanation"": ""The Triman label indicates compliance with French recycling sorting instructions, supporting the recyclability claim.""}], ""reasoning_summary"": ""The product packaging claims to be 100% recyclable and carries the Triman label, which is a recognized recycling symbol. These are specific and verifiable claims related to packaging recyclability, reducing greenwashing risk. No other sustainability claims or vague language are present. Therefore, the risk score is low (2)."", ""needs_human_check"": []}",True,specific,2,"{""claim_detected"": true, ""claim_modalities"": [""text"", ""image""], ""claim_types"": [""packaging_reduction"", ""certification_or_label""], ""specificity"": ""specific"", ""evidence_strength"": ""moderate"", ""risk_score"": 2, ""risk_label"": ""low"", ""evidence"": [{""modality"": ""text"", ""snippet"": ""Emballage recyclable à 100%"", ""explanation"": ""The text explicitly claims that the packaging is 100% recyclable, which is a specific and measurable sustainability claim.""}, {""modality"": ""image"", ""snippet"": ""Label 'Emballage recyclable à 100%' on packaging"", ""explanation"": ""The packaging image shows a clear label stating the packaging is 100% recyclable, supporting the claim made in the text.""}], ""reasoning_summary"": ""The product packaging and text explicitly claim that the packaging is 100% recyclable, which is a specific and verifiable claim. There are no other sustainability claims or cues beyond this. The presence of a recyclable packaging claim reduces risk, but since no further environmental benefits or certifications are provided, the risk is low rather than none."", ""needs_human_check"": []}",False,False,0,False
P020,True,specific,1,"{""claim_detected"": true, ""claim_modalities"": [""text""], ""claim_types"": [""organic_or_natural"", ""certification_or_label"", ""plant_based""], ""specificity"": ""specific"", ""evidence_strength"": ""strong"", ""risk_score"": 1, ""risk_label"": ""low"", ""evidence"": [{""modality"": ""text"", ""snippet"": ""*Ingrédients biologiques."", ""explanation"": ""Indicates ingredients are organic, a specific and verifiable claim.""}, {""modality"": ""text"", ""snippet"": ""Labels: Organic, Certified by Ecocert, EU Organic, DE-ÖKO-001, AB Agriculture Biologique"", ""explanation"": ""Multiple recognized organic certifications provide strong evidence for organic claim.""}, {""modality"": ""text"", ""snippet"": ""Categories: Plant-based foods and beverages, Plant-based foods"", ""explanation"": ""Clear categorization as plant-based food, a factual product attribute.""}], ""reasoning_summary"": ""The product makes specific, verifiable claims about organic ingredients supported by multiple recognized certifications. It is clearly identified as plant-based. These claims are specific and supported, resulting in a low greenwashing risk score of 1, reflecting weak or indirect cues only since the claims are factual and well substantiated."", ""needs_human_check"": []}",True,specific,1,"{""claim_detected"": true, ""claim_modalities"": [""text"", ""image""], ""claim_types"": [""organic_or_natural"", ""certification_or_label"", ""packaging_reduction""], ""specificity"": ""specific"", ""evidence_strength"": ""strong"", ""risk_score"": 1, ""risk_label"": ""low"", ""evidence"": [{""modality"": ""text"", ""snippet"": ""*Ingrédients biologiques. Labels: Organic, Certified by Ecocert, EU Organic, AB Agriculture Biologique."", ""explanation"": ""The product explicitly states it contains organic ingredients and displays multiple recognized organic certifications, which are specific and verifiable claims.""}, {""modality"": ""image"", ""snippet"": ""\""EMBALLAGE ENTIEREMENT RECYCLABLE\"" (packaging entirely recyclable)"", ""explanation"": ""The packaging clearly states it is fully recyclable, a specific and verifiable environmental claim about packaging.""}], ""reasoning_summary"": ""The product makes clear, specific claims about organic ingredients supported by recognized certifications, and about fully recyclable packaging. These claims are specific and supported by visible labels and text. The presence of multiple organic certifications and a recyclable packaging claim reduces greenwashing risk. The use of natural imagery and green colors supports the organic positioning but is not over-interpreted. Overall, the risk score is low (1) due to the presence of strong, specific claims with visible evidence and no vague or unsupported broad claims."", ""needs_human_check"": []}",False,False,0,False
P021,True,specific,1,"{""claim_detected"": true, ""claim_modalities"": [""text"", ""image""], ""claim_types"": [""organic_or_natural"", ""plant_based"", ""certification_or_label"", ""carbon_or_climate"", ""other""], ""specificity"": ""specific"", ""evidence_strength"": ""strong"", ""risk_score"": 1, ""risk_label"": ""low"", ""evidence"": [{""modality"": ""text"", ""snippet"": ""boisson biologique à base d'amandes sans sucres et d'algue Lithothamnium calcareum source de calcium, avec arôme naturel, stérilisée UHT"", ""explanation"": ""Specifies organic almond-based drink with natural aroma and calcium source from algae, indicating natural and organic ingredients.""}, {""modality"": ""text"", ""snippet"": ""Labels: Organic, Certified by Ecocert, EU Organic, Certified B Corporation, AB Agriculture Biologique, FR-BIO-01, IT-BIO-007, FSC, FSC Mix"", ""explanation"": ""Multiple recognized certifications supporting organic and sustainability claims.""}, {""modality"": ""text"", ""snippet"": ""100% vegetable, No added sugar, No palm oil, Plant-based"", ""explanation"": ""Clear plant-based and no palm oil claims, indicating environmental consideration.""}], ""reasoning_summary"": ""The product makes specific and verifiable sustainability claims including organic certification, plant-based composition, no palm oil, and recognized labels such as Ecocert and B Corporation. These claims are supported by ingredient details and certifications, reducing greenwashing risk. The presence of multiple certifications and specific ingredient information supports a low risk score. The packaging type (Tetra Pak) is noted but does not itself constitute a claim. Overall, the claims are specific and well supported, leading to a low greenwashing concern."", ""needs_human_check"": []}",True,specific,1,"{""claim_detected"": true, ""claim_modalities"": [""text"", ""image""], ""claim_types"": [""organic_or_natural"", ""plant_based"", ""carbon_or_climate"", ""certification_or_label"", ""other""], ""specificity"": ""specific"", ""evidence_strength"": ""strong"", ""risk_score"": 1, ""risk_label"": ""low"", ""evidence"": [{""modality"": ""text"", ""snippet"": ""Organic, Certified by Ecocert, EU Organic, AB Agriculture Biologique, Certified B Corporation, FR-BIO-01, IT-BIO-007, FSC, FSC Mix"", ""explanation"": ""Multiple recognized certifications and labels indicate organic production and sustainability standards, providing strong evidence for the claims.""}, {""modality"": ""text"", ""snippet"": ""100% vegetable, Calcium source, No added sugar, No palm oil"", ""explanation"": ""Specific claims about plant-based origin, nutritional benefit (calcium source), and absence of palm oil and added sugar add to the product's sustainability and health positioning.""}, {""modality"": ""image"", ""snippet"": ""AB Agriculture Biologique logo, 'Sans Sucres Ajoutés', 'BIO', 'Pauvre en acides gras saturés'"", ""explanation"": ""The packaging shows organic certification logos and text emphasizing no added sugar and low saturated fat, supporting the product's health and organic claims.""}], ""reasoning_summary"": ""The product makes multiple explicit sustainability claims including organic certification, plant-based origin, no palm oil, and nutritional benefits. These claims are supported by recognized certification logos visible on the packaging and detailed ingredient and label information. The claims are specific and supported, indicating a low risk of greenwashing. The presence of multiple certifications and specific claims reduces risk, while the natural imagery and green color are consistent but not solely relied upon for claims."", ""needs_human_check"": []}",False,False,0,False
P022,True,specific,1,"{""claim_detected"": true, ""claim_modalities"": [""text""], ""claim_types"": [""organic_or_natural"", ""plant_based"", ""certification_or_label"", ""carbon_or_climate""], ""specificity"": ""specific"", ""evidence_strength"": ""strong"", ""risk_score"": 1, ""risk_label"": ""low"", ""evidence"": [{""modality"": ""text"", ""snippet"": ""Organic, EU Organic, from organic farming, IT-BIO-009"", ""explanation"": ""The product is certified organic with specific certifications and codes, indicating a verifiable claim about organic sourcing.""}, {""modality"": ""text"", ""snippet"": ""Sugar-free plant-based, Vegan, Vegetarian, 100% vegetable"", ""explanation"": ""Clear claims about the product being plant-based and suitable for vegan and vegetarian diets, which are specific and verifiable.""}, {""modality"": ""text"", ""snippet"": ""Labels: FSC, FSC Mix, de:nachhaltige-verpackt, de:ressourcen-schützen"", ""explanation"": ""Presence of FSC certification and German labels indicating sustainable packaging and resource protection, supporting environmental claims.""}], ""reasoning_summary"": ""The product makes multiple specific and verifiable sustainability claims including organic certification, plant-based ingredients, and sustainable packaging certifications. These claims are supported by recognized labels and certifications, reducing greenwashing risk. The presence of multiple certifications and specific ingredient percentages supports a low risk score. No vague or broad claims are present."", ""needs_human_check"": []}",True,mixed,3,"{""claim_detected"": true, ""claim_modalities"": [""text"", ""image""], ""claim_types"": [""organic_or_natural"", ""plant_based"", ""carbon_or_climate"", ""certification_or_label"", ""vague_eco_language""], ""specificity"": ""mixed"", ""evidence_strength"": ""moderate"", ""risk_score"": 3, ""risk_label"": ""medium"", ""evidence"": [{""modality"": ""text"", ""snippet"": ""from organic farming, Organic, EU Organic, IT-BIO-009"", ""explanation"": ""Explicit organic certification claims indicate the product is made with organic ingredients, which is a specific and verifiable sustainability claim.""}, {""modality"": ""text"", ""snippet"": ""Sugar-free plant-based, Vegan, Vegetarian, No gluten, No lactose, 100% vegetable"", ""explanation"": ""Claims about being plant-based, vegan, and free from certain ingredients suggest environmental and health positioning, moderately specific but common claims.""}, {""modality"": ""text"", ""snippet"": ""Labels including FSC, de:nachhaltige-verpackt, de:ressourcen-schützen"", ""explanation"": ""Presence of FSC label and German sustainability packaging/resource protection labels imply some environmental consideration in packaging, but details are not fully visible or explained.""}, {""modality"": ""image"", ""snippet"": ""Bio Organic, Vegan logo, Almond image, 'No sugars'"", ""explanation"": ""Visual cues reinforce organic and vegan claims, and the almond image supports plant-based nature; 'No sugars' is a health claim, not sustainability.""}], ""reasoning_summary"": ""The product makes several explicit sustainability claims including organic certification, plant-based and vegan status, and packaging certifications like FSC. These claims are specific and supported by recognized labels, though some labels are not fully detailed. The presence of multiple certifications and ingredient sourcing claims reduces greenwashing risk. However, some claims like 'Bio Organic' and 'Vegan' are broad and common, and the packaging sustainability claims are not fully detailed, leading to a moderate risk score."", ""needs_human_check"": [""Verification of the authenticity and scope of the FSC and German sustainability packaging labels"", ""Clarification on the extent of organic ingredient sourcing beyond the 2.3% almonds mentioned""]}",False,True,2,True
